name,agu,district,code
"MODEL RESIDENTIAL SCHOOL, PATTUVAM, KANNUR, [FIRST YR ONLY]",G,13,13128
"MASS GOVT HSS, ETTIKKULAM, KANNUR, [FIRST YR ONLY]",G,13,13129
"GHSS KOTTAYAM, KANNUR, [FIRST YR ONLY]",G,13,13130
"GHSS MADAYI, MADAYI, KANNUR, [FIRST YR ONLY]",G,13,13131
"GOVT HSS,CHEEMENI,KASARGODE",G,14,14001
"GOVT HSS,KAMBALLUR,KASARGODE",G,14,14002
"GOVT HSS,KUMBLA,KASARGODE",G,14,14003
"GOVT HSS,KUNDANKUZHI,KASARGODE",G,14,14004
"GOVT HSS,MOGRALPUTHUR,KASARGODE",G,14,14005
"GOVT HSS,PILICODE,KASARGODE",G,14,14006
"GOVT HSS,KAKKAD,KASARGODE",G,14,14007
"GOVT HSS,UDINUR,KASARGODE",G,14,14008
"GOVT HSS,MADIKKAI,KASARGODE",G,14,14009
"GOVT HSS,MALOTH KASBA,KASARGODE",G,14,14010
"GOVT HSS,KUTTAMATH,,KASARGODE",G,14,14011
"GOVT HSS, CHERKALA, KASARGODE",G,14,14012
"GOVT HSS, PADRA, ENKANJE, KASARGODE",G,14,14013
"GOVT HSS, PAIVALIKA NAGAR, KASARGODE",G,14,14014
"AMBEDKAR HSS, KODOTH, HOSDURG, KASARGODE",G,14,14015
"GOVT HSS, CHAYOTH, HOSDURG, KASARGODE",G,14,14016
"GOVT HSS, UDUMA, KASARGODE",G,14,14017
"GOVT HSS, PADNEKADAPPURAM, KASARGODE",G,14,14018
"GOVT HSS, BALANTHODE, KASARGODE",G,14,14019
"IQBAL HSS,AJANUR,,KASARGODE",A,14,14020
"DURGA HSS,KANJANGAD,,KASARGODE",A,14,14021
"HHSIBS HSS,EDNEER,,KASARGODE",A,14,14022
"CHATTANCHAL HSS,THEKKIL, KASARGODE",A,14,14023
"SS HSS,KATTUKUKKE,KASARGODE",A,14,14024
"CHEMNAD JAMA ATH HSS,,KASARGODE",A,14,14025
"ST THOMAS HSS,THOMAPURAM,,KASARGODE",A,14,14026
"TI. HSS, NAIMARMOOLA, KASARGODE",A,14,14027
"B.A.R HSS, BOVIKANA, KASARGODE",A,14,14028
"HOLY FAMILY HSS, RAJAPURAM, KASARGODE",A,14,14029
"ST. JUD'S HSS, VELLARIKUNDU, KASARGODE",A,14,14030
"CH MKS HSS, MUTTAMMAL, ELAMBACHI",U,14,14031
"JAMA-ATH HSS, CHITHARI",U,14,14032
"NA GIRLS HSS, ERATHUMKADAVU, CHENKALA",U,14,14033
"LITTLE FLOWER HSS, KANJANGADU",U,14,14034
"DHAKKEERATH EM HSS, THALANGARA, KASARAGOD",U,14,14035
"UDAYA EMHSS, MANJESWARAM, NON EXAM CENTRE CLUBBED TO 14014",U,14,14036
"AMBEDKAR VIDYANIKETHAN HSS, PERIYA, PALLIKKARA",U,14,14037
"GOVT. HSS, BANGARA MANJESHWARAM, KASARGODE",G,14,14038
"GOVT. HSS, UPPALA, KASARGODE",G,14,14039
"GOVT. MVHSS, THALANGARA, KASARGODE",G,14,14040
"GOVT. VHSS FOR GIRLS, KASARGODE",G,14,14041
"GOVT. HSS, SOUTH THRIKKARIPPOOR, ELAPZCHY.P.O, KAS",G,14,14042
"GOVT. HSS, KASARGODE",G,14,14043
"GOVT. HSS, EDANEER, KASARGODE",G,14,14044
"GOVT. VHSS, MULLERIYA, KASARGODE",G,14,14045
"GOVT. HSS, BELLERU, KASARGODE",G,14,14046
"GOVT. HSS, PADLA, KASARGODE",G,14,14047
"GOVT. VHSS, IRIYANNI, KASARGODE",G,14,14048
"GOVT. HSS, HOSDURG (KANJANGAD), KASARGODE",G,14,14049
"GOVT. HSS, PARAPPA (HOSDURG), KASARGODE",G,14,14050
"GOVT. HSS, ANGADIMUGAR, KASARGODE",G,14,14051
"GOVT. HSS, BETHOOPPARA, KASARGODE",G,14,14052
"GOVT. HSS, ADOOR, ELAMPADY PANCHAYATH, KASARGODE",G,14,14053
"GOVT. HSS, PALLIKKARA, KASARGODE",G,14,14054
"GOVT. HSS, CHANDRAGIRI, KASARGODE",G,14,14055
"GOVT. HSS, CHEMMANAD, PARAVANADUKKAM, KASARGODE",G,14,14056
"GOVT. HSS, ALAMPADY, CHENGALA, KASARGODE",G,14,14057
"GOVT. HSS, ADHOOR, KARADUKKA PANCHAYATH, KASARGODE",G,14,14058
"GOVT. HSS, PERIYA, KASARGODE",G,14,14059
"GOVT. HSS, BELLA, KASARGODE",G,14,14060
"G.F.HSS, CHERUVATHOOR, KASARGODE",G,14,14061
"G.V.HSS, MOGRAL, KASARGODE",G,14,14062
"GOVT. HSS, BEKKOOR, KASARGODE",G,14,14063
"GOVT. HSS, BANDADUKKA, KASARGODE",G,14,14064
"GOVT. HSS, KALLIYOD, KASARGODE",G,14,14065
"MODEL RESIDENTIAL HSS, UDUMA, KASARGODE",G,14,14066
"GOVT. HSS, SHIRIYA, KASARGODE",G,14,14067
"G.F. HSS, BEKKAL, KASARGODE",G,14,14068
"GOVT. HSS, MANGALPADY, KASARGODE",G,14,14069
"TECHNICAL HSS, CHEEMENI,KASARGODE.",T,14,14070
"MARTHOMA HSS FOR DEAF,KASARGODE.",U,14,14071
"KUNIL EDUCATION TRUST HSS, KASARGODE",U,14,14072
"P. BEERAN MEMORIAL EM HSS, NELLIKATTA, KASARAGODE",U,14,14073
"MALABAR ISLAMIC COMPLEX HSS, CHATTANCHAL, KASARGOD",U,14,14074
"PALLIKKARA ISLAMIC ENGLISH MEDIUM HSS, KASARGODE",U,14,14075
"ST. JOSEPH'S HSS, CHERUPUZHA, KASARGODE",U,14,14076
"KALANAD HYDROSE JAMA AH HSS, KALANAD, KASARGOD",U,14,14077
"GHSS, THAYANNOOR, KASARAGOD, [FIRST YR ONLY]",G,14,14078
"GHSS, RAVANESWARAM, KASARGOD, [FIRST YR ONLY]",G,14,14079
"GHSS, KOTTODI, KASARAGOD, [FIRST YR ONLY]",G,14,14080
"GHSS, PAIVALIK, KASARAGOD, [FIRST YR ONLY]",G,14,14081
"NEW INDIAN HIGHER SECONDARY SCHOOL,RAS AL KHAIMAH",U,15,15001
"THE ENGLISH SCHOOL, UM-AL-QUWAIN, U.A.E.",U,15,15002
"NEW INDIAN MODEL HSS, DUBAI, U.A.E.",U,15,15004
"THE MODEL SCHOOL, ABUDHABI, U.A.E.",U,15,15005
"INDIAN SCHOOL, FUJAIRAH, U.A.E.",U,15,15006
"THE GULF MODEL SCHOOL, DUBAI, U.A.E",U,15,15007
"NEW INDIAN MODEL HSS, SHARJAH, U.A.E.",U,15,15008
"MES INDIAN HSS, DOHA, QUATAR",U,15,15009
"THE INDIAN SCHOOL, DARSAIT, OMAN",U,15,15010
"NEW INDIAN MODEL HSS, AL-AIN, UAE",U,15,15011
"GOVT. SENIOR SECONDARY SCHOOL, MINICOY, LAKSHADWEEP",U,16,16001
"GOVT. JN SENIOR SECONDARY SCHOOL, KADAMATH, LAKSHADWEEP",U,16,16002
"MG SENIOR SECONDARY SCHOOL, ANDROTH, LAKSHADWEEP",U,16,16003
"GOVT. SENIOR SECONDARY SCHOOL, KAVARATHI, LAKSHADW",U,16,16004
"GOVT. SENIOR SECONDARY SCHOOL, KALPENI, LAKSHADWEE",U,16,16005
"GOVT. SENIOR HSS, AMINI, LAKSHADWEEP",U,16,16006
"GOVT. SENIOR SECONDARY SCHOOL, AGATTI ISLAND, LAKS",U,16,16007
"GOVT. SENIOR SENIOR SECONDARY SCHOOL, KILTAN",G,16,16008
"GOVT. SENIOR SECONDARY SCHOOL, CHETLAT, LAKSHADWEEP",U,16,16009
"GOVT HSS, PANDAKKAL, MAHE",U,17,17001
"JAWAHARLAL NEHRU GOVT. HSS, MAHE",U,17,17002
"GOVT. HIGHER SECONDARY SCHOOL, MAHE",U,17,17003
"GOVT HSS PALLOUR, MAHE, NADUTHARA P.O.",U,17,17004
