name,agu,district,code
"GOVT MODEL BOYS HSS, ATTINGAL",G,1,1001
"GOVT. GIRLS HSS, COTTONHILL, TRIVANDRUM",G,1,1002
"GOVT. V.H.S.S  FOR THE DEAF, JAGATHY, TRIVANDRUM",G,1,1003
"DR AMMR HSS ,KATTELA, SREEKARIAM P.O,  TRIVANDRUM",G,1,1004
"GOVT HSS, KILIMANOOR, TRIVANDRUM",G,1,1005
"GOVT. V & GIRLS HSS, MANACAUD, TRIVANDRUM",G,1,1006
"GOVT. HSS, MEDICAL COLLEGE, TRIVANDRUM",G,1,1007
"GOVT. BOYS HSS, MITHIRMALA, TRIVANDRUM",G,1,1008
"GOVT GIRLS HSS, NEDUMANGAD, TRIVANDRUM",G,1,1009
"GOVT. HSS, NEDUVELI, VENJARAMOOD, TRIVANDRUM",G,1,1010
"GOVT. GIRLS HSS, NEYYATTINKARA, TRIVANDRUM",G,1,1011
"GOVT HSS, PAKALKURI, PALLICKAL,TRIVANDRUM",G,1,1012
"GOVT. HSS, PALAYAMKUNNU, TRIVANDRUM",G,1,1013
"GOVT. HSS, PIRAPPANCODE, TRIVANDRUM",G,1,1014
"GOVT. BOYS HSS, PETTAH, TRIVANDRUM",G,1,1015
"S.M.V. GOVT.MODEL HSS, TRIVANDRUM",G,1,1016
"GOVT. HSS,VETTOOR, TRIVANDRUM",G,1,1017
"GOVT. HSS, KULATHOOR, TRIVANDRUM",G,1,1018
"GOVT. GIRLS HSS, MITHIRMALA, TRIVANDRUM",G,1,1019
"GOVT. HSS, THOLIKODE, TRIVANDRUM",G,1,1020
"GOVT. MODEL GIRLS HSS, PATTOM, TRIVANDRUM",G,1,1021
"GOVT. HSS, KAMALESWARAM, TRIVANDRUM",G,1,1022
"GOVT.  MODEL BOYS HSS, THYCAUD, TRIVANDRUM",G,1,1023
"GOVT. HSS,  VENJARAMOODU, TRIVANDRUM",G,1,1024
"GOVT. HSS, BALARAMAPURAM, TRIVANDRUM",G,1,1025
"GOVT. BHSS, NEYYATTINKARA, TRIVANDRUM",G,1,1026
"GOVT. HSS, ANAVOOR, TRIVANDRUM",G,1,1027
"GOVT MODEL HSS, VARKALA TRIVANDRUM",G,1,1028
"PNM GOVT. HSS,KOONTHALLUR, CHIRAYINKEEZHU, TRIVAND",G,1,1029
"GOVT GIRLS HSS, ATTINGAL, TRIVANDRUM",G,1,1030
"GOVT HSS, NAVAIKULAM, TRIVANDRUM",G,1,1031
"GOVT.HSS, BHARATHANNUR, TRIVANDRUM",G,1,1032
"GOVT VHSS, KARAKULAM, TRIVANDRUM",G,1,1033
"GOVT HSS, THONNAKKAL, TRIVANDRUM",G,1,1034
"PSNPM GOVT HSS, PEROORKADA, TRIVANDRUM",G,1,1035
"GOVT GIRLS HSS, KARAMANA, TRIVANDRUM",G,1,1036
"GOVT GIRLS HSS, MALAYINKIL, TRIVANDRUM",G,1,1037
"GOVT HSS, PUNNAMOODU,TRIVANDRUM",G,1,1038
"GOVT HSS, NEEYYARDAM, TRIVANDRUM",G,1,1039
"KULATHUMMAL GOVT HSS, KATTAKKADA, TRIVANDRUM",G,1,1040
"GOVT MODEL BOYS HSS, CHALAI, TRIVANDRUM",G,1,1041
"GOVT VHSS, VELLANAD, TRIVANDRUM",G,1,1042
"GOVT HSS, MARAYAMUTTAM, TRIVANDRUM",G,1,1043
"GOVT TAMIL HSS, CHALAI,TRIVANDRUM",G,1,1044
"GOVT VHSS, KULATHOOR,UCHAKKADA, TRIVANDRUM",G,1,1045
"NKM GIRLS HSS, DHANUVACHAPURAM, TRIVANDRUM",G,1,1046
"CONCORDIA LUTHERAN HSS, PEROORKADA, TRIVANDRUM",A,1,1047
"S.S.V HSS, CHIRAYINKIL, TRIVANDRUM",A,1,1048
"LEO XIII HSS, PULLUVILA, TRIVANDRUM",A,1,1049
"SIVAGIRI HSS, VARKALA, TRIVNDRUM",A,1,1050
"ST.JOSEPH'S  HSS,  ANCHENGO, TRIVANDRUM",A,1,1051
"R.R.V.GIRLS HSS, KILLIMANOOR, TRIVANDRUM",A,1,1052
"JANATHA HSS, THEMBAMOOD, TRIVANDRUM",A,1,1053
"M.V HSS, THUNDATHIL, TRIVANDRUM",A,1,1054
"PALLITHURA HSS, PALLITHURA, TRIVANDRUM",A,1,1055
"ST.ANTONY'S HSS, VALIATHURA, TRIVANDRUM",A,1,1056
"ST. MARY'S HSS, VETTUKAD, TRIVANDRUM",A,1,1057
"R.K.D.N.S.S  HSS, SASTHAMANGALAM, TRIVANDRUM",A,1,1058
"ST.JOSEPH'S HSS, TRIVANDRUM",A,1,1059
"L.M.S BOYS HSS, AMARAVILA, TRIVANDRUM",A,1,1060
"M.V. HSS, ARUMANOOR, TRIVANDRUM",A,1,1061
"GIRLS HSS, VENGANOOR, TRIVANDRUM",A,1,1062
"V.P.S. BOYS HSS, VENGANOOR, TRIVANDRUM",A,1,1063
"UNDENCODE ST JOHN'S HSS, CHERIYAKOLLA, TRIVANDRUM",A,1,1064
"S.N.V  HSS, NEDUNGANDA, TRIVANDRUM",A,1,1065
"ST. MARY'S HSS, PATTOM, TRIVANDRUM",A,1,1066
"IQBAL HSS, PERINGAMALA, TRIVANDRUM",A,1,1067
"L.M.S.HSS, CHEMBOOR, TRIVANDRUM",A,1,1068
"NEW  HSS, NELLIMOODU, TRIVANDRUM",A,1,1069
"S.N G. HSS, CHEMPAZHANTHY, TRIVANDRUM",A,1,1070
"S.N.V.  HSS, ANAD, TRIVANDRUM",A,1,1071
"ST JOHNS MODEL HSS,NALANCHIRA,TRIVANDRUM",A,1,1072
"NSS HSS,PALKULANGARA,TRIVANDRUM",A,1,1073
"SN HSS, UZHAMALAKKAL, TRIVANDRUM",A,1,1074
"ST THOMAS HSS,POONTHURA,TRIVANDRUM",A,1,1075
"MUSLIM GIRLS HSS,KANIYAPURAM,TRIVANDRUM",A,1,1076
"MCHSS,KOTTUKALKONAM,TRIVANDRUM",A,1,1077
"SALVATION ARMY HSS,KOWDIAR,TRIVANDRUM",A,1,1078
"PKS HSS, KANJIRAMKULAM, TRIVANDRUM",A,1,1079
"LMS HSS, VATTAPPARA, TRIVANDRUM",A,1,1080
"ST MARY'S HSS,VIZHINJAM,TRIVANDRUM",A,1,1081
"MUSLIM HSS,EDAVA,TRIVANDRUM",A,1,1082
"JANARDHANAPURAM HSS,OTTASEKHARAMANGALAM, TRIVANDRU",A,1,1083
"DVMNNM HSS, MARANALLUR, TRIVANDRUM",A,1,1084
"VTMNSS GIRLS HSS,DHANUVACHAPURAM, TRIVANDRUM",A,1,1085
"ST.THOMAS HSS,AMBOORI,TRIVANDRUM",A,1,1086
"ST XAVIER'S HSS,PEYAD,TRIVANDRUM",A,1,1087
"AM HSS, THIRUMALA, TRIVANDRUM",A,1,1088
"BNVV HSS,THIRUVALLAM,TRIVANDRUM",A,1,1089
"MULAMANA VHSS, VAMANAPURAM, TRIVANDRUM",A,1,1090
"AL- UTH-UMAN ENGLISH MEDIUM HSS, KAZHAKKOOTTAM, TRIVANDRUM",U,1,1091
"TECHNICAL HSS, MUTTADA P.O., TRIVANDRUM-695025",T,1,1092
"BEEMA MAHEEN HSS, BEEMAPALLY, TRIVANDRUM",U,1,1093
"CHRIST NAGAR EM HSS, TRIVANDRUM",U,1,1094
"HOLY ANGELS CONVENT HSS, TRIVANDRUM",U,1,1095
"LAYOLA HSS, SREEKARIYAM, TRIVANDRUM",U,1,1096
"LOURDE MOUNT HSS, VATTAPPARA, TRIVANDRUM",U,1,1097
"MMR HSS, NEERAMANKARA, TRIVANDRUM",U,1,1098
"NAVABHARATHI HSS, ATTINGAL, TRIVANDRUM",U,1,1099
"NIRMALA BHAVAN EM HSS, KAWDIAR, TRIVANDRUM",U,1,1100
"SARVODAYA VIDYALAYA HSS, NALANCHIRA, TRIVANDRUM",U,1,1101
"DARSANA HSS, NEDUMANGADU, TRIVANDRUM",U,1,1102
"ST. MARY'S HSS, KAMUKINKODE, TRIVANDRUM",U,1,1103
"ST.THERESA'S CONVENT GHSS, NEYYATTINKARA, TRIVANDR",U,1,1104
"CARMEL GIRLS HSS, VAZHUTHACAD, TRIVANDRUM",U,1,1105
"ST.GORETTI'S HSS, NALANCHIRA, TRIVANDRUM",U,1,1106
"SSM HSS, KOCHALUMOODU, MUDAPURAM, CHIRAYINKIL, TRI",U,1,1107
"EVANS HSS, PARASALA, TRIVANDRUM",U,1,1108
"NSS HSS, PERUNTHANNI, TRIVANDRUM",U,1,1109
"ST. CHRISOSTEM EM HSS, NELLIMMOODU, TRIVANDRUM",U,1,1110
"SHREE VIDYADHI RAJA VIDYAMANDIR HSS, VELLAYAMBALAM, TRIVANDRUM",U,1,1111
"Sr. ELIZEBETH JOEL CSI EM HSS, ATTINGAL, TRIVANDRU",U,1,1112
"CHINMAYA VIDYALAYA HSS, VAZHUTHACAUD, TRIVANDRUM",U,1,1113
"JYOTHI NILAYAM HSS, KAZHAKKOOTTAM, TRIVANDRUM",U,1,1114
"LITTLE  FLOWER EM HSS, EDAVA, TVM, NEC CLUBBED TO 01028",U,1,1115
"OUR LADY OF MERCY HSS, PUTHUKURISSI, TRIVANDRUM",U,1,1116
"FR. PHILIP'S HSS, NELLIKODU, TRIVANDRUM",U,1,1117
"SREENEELAKANTA VIDYAPITOM, CHENKOTTUKONAM, TVM",U,1,1118
"HOLY TRINITY HSS, ALTHARA, SREEKARYAM, TRIVANDRUM",U,1,1119
"PTM HSS, MARUTHURKONAM, TRIVANDRUM",U,1,1120
"ST. HELEN'S GHSS, LOURDUPURAM, TRIVANDRUM",U,1,1121
"ROSAMISTICA HSS, PULIMKUDY, TRIVANDRUM",U,1,1122
"SAMUEL LMS HSS PARASSALA, TRIVANDRUM",U,1,1123
"VICTORY GIRLS HSS, NEMOM, TRIVANDRUM",U,1,1124
"MANARUL HUDA HSS, PAZHAKUTTY, TRIVANDRUM",U,1,1125
"TECHNICAL HSS, ATTINGAL, TRIVANDRUM",T,1,1126
"P.R.WILLIAM HSS, KATTAKADA, TRIVANDRUM",A,1,1127
"GOVT. HSS, VAKKOM, TRIVANDRUM",G,1,1128
"SNV GOVT. HSS, KADAKKAVOOR, TRIVANDRUM",G,1,1129
"GOVT. GHSS, PEROORKADA, TRIVANDRUM",G,1,1130
"GOVT. VHSS, POOVAR, TRIVANDRUM",G,1,1131
"GOVT. HSS, VILAVOORKAL, TRIVANDRUM",G,1,1132
"GOVT. HSS, AIROORPARA, TRIVANDRUM",G,1,1133
"GOVT. BOYS HSS, KARAMANA, TRIVANDRUM",G,1,1134
"GOVT. VHSS, PARASSALA, TRIVANDRUM",G,1,1135
"GOVT. LVHSS, ARAYOOR, CHENGAL, TRIVANDRUM",G,1,1136
"GOVT. VHSS, ARYANAD, TRIVANDRUM",G,1,1137
"GOVT. HSS, POOVACHAL, TRIVANDRUM",G,1,1138
"GOVT. HSS, ARUVIKKARA, TRIVANDRUM",G,1,1139
"GOVT. HSS, KAZHAKUTTOM, TRIVANDRUM",G,1,1140
"GOVT. HSS, KAVALAYOOR, TRIVANDRUM",G,1,1141
"GOVT. HSS, KAPPIL, TRIVANDRUM",G,1,1142
"GOVT. HSS, MYLACHAL, ARIYANGODE, TRIVANDRUM",G,1,1143
"GOVT. VHSS, VATTIYOORKAVU, TRIVANDRUM",G,1,1144
"GOVT. VHSS, VITHURA, TRIVANDRUM",G,1,1145
"GOVT. HSS FOR GIRLS, KANNIAKULANGARA, TRIVANDRUM",G,1,1146
"GOVT. HSS, POOVATHOOR, TRIVANDRUM",G,1,1147
"GOVT. HSS, AZHOOR, TRIVANDRUM",G,1,1148
"ELAMBA GHSS, TRIVANDRUM",G,1,1149
"THATTATHUMALA GOVT. HSS, TRIVANDRUM",G,1,1150
"GOVT. HSS, KEEZHAROOR, TRIVANDRUM",G,1,1151
"VENGANOOR GOVT. MODEL HSS, TRIVANDRUM",G,1,1152
"GOVT. VHSS, ALAMCODE, TRIVANDRUM",G,1,1153
"GOVT. HSS, PALLICKAL, TRIVANDRUM",G,1,1154
"NSS HSS, M.G.COLLEGE CAMPUS, THIRUVANANTHAPURAM",A,1,1155
"CORDOVA HSS,AMBALATHARA,POONTHURA., THIRUVANANTHAP",U,1,1156
"ST. THOMAS HSS, MUKKOLAKKAL, THIRUVANANTHAPURAM",U,1,1157
"KTCT EMR HSS, KADUVAYIL, THOTTAKKAD, KALLAMBALAM,",U,1,1158
"GEM KNOW MODEL HSS, MEL-VETTOOR, VARKALA, THIRUVAN",U,1,1159
"SREE VIDHYADHI RAJA EM HSS, ATTINGAL, THIRUVANANTHAPURAM",U,1,1160
"SREE VIDHYADHI RAJA VIDYANILAYAM HSS, NEYYATTINKARA, THIRUVANANTHAPURAM",U,1,1161
"SANTHIGIRI VIDYABHAVAN HSS, SANTHIGIRI, THIRUVANAN",U,1,1162
"SRI SATHYA SAI HSS, VELLANAD, TVM",U,1,1163
"SREE  AYYANKALI MEMORIAL GOVT. MODEL RESIDENTIAL SCHOOL, VELLAYANI, THIRUVANANTHAPURAM",G,1,1164
"GOVT BHSS, CHAVARA, KOLLAM",G,2,2001
"AYYANKOYIKKAL GOVT. HSS, CHAVARA, MUKUNDAPURAM, KOLLAM",G,2,2002
"GOVT  HSS, KARUNAGAPPALLY, KOLLAM",G,2,2003
"GOVT MODEL BOYS HSS, THEVALLY, KOLLAM",G,2,2004
"GOVT BOYS HSS, KOTTARAKKARA, KOLLAM",G,2,2005
"GOVT HSS, KULASEKHARAPURAM, KOLLAM",G,2,2006
"GOVT HSS, KUZHIMATHIKAD, KOLLAM",G,2,2007
"GOVT HSS, VELLAMANAL, KOLLAM",G,2,2008
"GOVT HSS, BHOOTHAKULAM, KOLLAM",G,2,2009
"GOVT HSS, PUNALUR, KOLLAM",G,2,2010
"GOVT HSS, VALATHUNGAL, KOLLAM",G,2,2011
"GOVT HSS, VAYALA, KOLLAM",G,2,2012
"GOVT HSS, OTTAKKAL, KOLLAM",G,2,2013
"GOVT HSS, KARUKONE, KOLLAM",G,2,2014
"GOVT HSS, WEST KALLADA, KOLLAM",G,2,2015
"GOVT HSS, VALLIKEEZHU, KOLLAM",G,2,2016
"GOVT  HSS, PANMANAMANAYIL, KOLLAM",G,2,2017
"GOVT HSS, ANJALUMMOODU, KOLLAM",G,2,2018
"GOVT HSS, MANGAD, KOLLAM",G,2,2019
"GHSS KUMMIL, KOLLAM",G,2,2020
"GOVT FISHERIES HSS,KUZHITHURA,ALAPPAT,KOLLAM",G,2,2021
"GOVT HSS, SOORAANAD, KOLLAM",G,2,2022
"GOVT MG HSS,CHADAYAMANGALAM,KOLLAM",G,2,2023
"GOVT HSS,ANCHAL WEST,KOLLAM",G,2,2024
"GOVT HSS,SASTHAMKOTTA,KOLLAM",G,2,2025
"GOVT HSS, PALLIMAN, KOLLAM",G,2,2026
"MEENAKSHI VILASOM HSS,PEROOR,KOLLAM",G,2,2027
"GOVT VHSS,PATTAZHI,KOLLAM",G,2,2028
"MOHAMMEDEN GOVT HSS,EDATHARA,KOLLAM",G,2,2029
"GOVT HSS, KULATHUPUZHA, KOLLAM",G,2,2030
"GOVT MODEL HSS,VETTIKKAVALA,KOLLAM",G,2,2031
"GOVT GIRLS HSS,THAZHAVA,KOLLAM",G,2,2032
"GOVT HSS,CHATHANNOOR,KOLLAM",G,2,2033
"GOVT HSS,PUTHUR,KOLLAM",G,2,2034
"GOVT HSS,PARAVUR,KOLLAM",G,2,2035
"GUHANANDAPURAM HSS, CHAVARA SOUTH, KOLLAM",A,2,2036
"AMRUTHA SANSKRIT HSS, PARIPPALLY, KOLLAM",A,2,2037
"MILADE SHERIF HSS, MYNAGAPPALLY, KOLLAM",A,2,2038
"ODANAVATTOM KRGPM HSS, ODANAVATTOM, KOLLAM",A,2,2039
"V V HSS POREDAM, KOLLAM",A,2,2040
"SN HSS CHITHARA, KOLLAM",A,2,2041
"ST. GREGORIOUS  HSS, KOTTARAKKARA, KOLLAM",A,2,2042
"S.M  HSS, KOTTARA, KOLLAM",A,2,2043
"S.M  HSS, PATHARAM, KOLLAM",A,2,2044
"B.J.S.M  MADATHIL HSS, THAZHAVA, KOLLAM",A,2,2045
"S.V  HSS, CLAPPANA, KOLLAM",A,2,2046
"AT. ANTONY'S   HSS, KANJIRAKODE, KOLLAM",A,2,2047
"S.N.D.P.Y  HSS, NEERAVIL, KOLLAM",A,2,2048
"M.S.M  HSS, CHATHINAMKULAM, KOLLAM",A,2,2049
"N.S.S  HSS, CHATHANNOR, KOLLAM",A,2,2050
"S.N.S.M  HSS, ELAMPALLOOR, KOLLAM",A,2,2051
"M.K.L.M. HSS, KANNANALLOOR, KOLLAM",A,2,2052
"CP HSS KUTTIKKADU, KOLLAM",A,2,2053
"CHEMPAKASSERY HSS, POOTHAKULAM, KOLLAM",A,2,2054
"IRUMPANANGADU HSS,  IRUMPANANGADU, KOLLAM",A,2,2055
"KRIST RAJ HSS, KOLLAM",A,2,2056
"ST.STEPHEN'S HSS, PATHANAPURAM, KOLLAM",A,2,2057
"EVHSS,NEDUVATHUR,KOLLAM",A,2,2058
"DR CT EAPEN MEMORIAL HSS,SASTHAMCOTTA, KOLLAM",A,2,2059
"EZHIPPURAM HSS, PARIPPALLI, KOLLAM",A,2,2060
"MAYYANADU HSS,MAYYANADU,KOLLAM",A,2,2061
"VIMALA HRIDAYA GHSS,KOLLAM",A,2,2062
"AKM HSS, MAILAPUR, ERAVIPURAM, KOLLAM",A,2,2063
"THADIKAD HSS, THADIKAD, ANCHAL, KOLLAM",A,2,2064
"ST GORETTI HSS,PUNALUR,KOLLAM",A,2,2065
"POOVATHOOR OVNSS HSS, KOTTARAKKARA, KOLLAM",A,2,2066
"ST ALOSIOUS HSS,KOLLAM",A,2,2067
"NSS HSS,PRAKKULAM,KOLLAM",A,2,2068
"SIVARAM NSS HSS, KARIKODE, KOLLAM",A,2,2069
"V.G.S.S AMBIKODAYAM  HSS , KUNNATHOOR EAST P.O, KO",A,2,2070
"HSS BOYS PUNALUR, KOLLAM",A,2,2071
"CVKM HSS,EAST KALLADA,KOLLAM",A,2,2072
"KPMEM HSS CHERIYAVELINELLOOR, KOLLAM",A,2,2073
"MM HSS,UPPODU,EAST KALLADA,KOLLAM",A,2,2074
"BOYS HSS, KARUNAGAPPALLY, KOLLAM",A,2,2075
"MM HSS NILAMEL, KOLLAM",A,2,2076
"TKM HSS,KARIKKODE,KOLLAM",A,2,2077
"SREE NARAYANA TRUST HSS,KOLLAM",A,2,2078
"SVM MHSS, VENDAR, KOLLAM",A,2,2079
"CSI VOCATIONAL HS&HSS FOR DEAF,VALAKOM,KOLLAM",A,2,2080
"ST. JOSEPHS CONVENT HSS, KOLLAM",U,2,2081
"ST. JUDE'S HSS ALUMOODU, MUKHATHALA, KOLLAM",U,2,2082
"ST. MARY'S HSS, KIZHAKEKARA, KOLLAM",A,2,2083
"VELLIMON HSS, VELLIMON, KOLLAM",U,2,2084
"VHSS, MANJAPPARA, KOLLAM",U,2,2085
"JOHN F KENNADY M HSS KARUNAGAPPALLY, KOLLAM",U,2,2086
"LOURD MATHA HSS, KOVILTHOTTAM, KOLLAM",U,2,2087
"NEHRU MEMORIAL HSS, KAITHAKUZHY, KOLLAM",U,2,2088
"MOUNT CARMEL EM HSS, MATHILAKOM, KOLLAM",U,2,2089
"ST.JOHN'S HSS, KARUVELIL, EZHUKONE, KOLLAM",U,2,2090
"SDA HSS, KOTTARAKKARA, KOLLAM",U,2,2091
"SABARIGIRI HSS, ANCHAL, KOLLAM",U,2,2092
"MOUNT TABORE HSS, PATHANAPURAM, KOLLAM",U,2,2093
"RV HSS, VALAKOM, KOLLAM",U,2,2094
"TVTM HSS, VELIYAM, KOLLAM",U,2,2095
"VHSS, VAYANAKOM, KOLLAM",U,2,2096
"MUSLIM EDUCATIONAL ASSOCIATION E.M.HSS, KARIKKODU, KOLLAM , (1st Year only)",U,2,2097
"JAWAHAR HSS, AYUR, KOLLAM",A,2,2098
"AKMV HSS, THADIKKADU, ANCHAL, KOLLAM",U,2,2099
"GOVT. HSS, KOIKKAL, KOLLAM",G,2,2100
"TKDM GVHSS, KADAPPAKADA, KOLLAM",G,2,2101
"GOVT. HSS, PERINGALAM, KOLLAM",G,2,2102
"GOVT. HSS, ASHTAMUDY, KUNDARA, KOLLAM",G,2,2103
"GOVT. VHSS, PUNNALA, KOLLAM",G,2,2104
"GOVT. HSS, CHITHARA, KOLLAM",G,2,2105
"GOVT. HSS, MUTTARA, KOTTARAKKARA, KOLLAM",G,2,2106
"GOVT. HSS, NEDUMGOLAM, KOLLAM",G,2,2107
"GOVT. HSS, OACHIRA, KOLLAM",G,2,2108
"GOVT. HSS, YEROOR, KOLLAM",G,2,2109
"GOVT. HSS, THEVANNOOR, KOLLAM",G,2,2110
"GOVT. HSS, THODIYOOR, KOLLAM",G,2,2111
"GOVT. HSS, KULAKKADA, KOTTARAKKARA, KOLLAM",G,2,2112
"GOVT. HSS, PORUVAZHY, KUNNATHOOR, KOLLAM",G,2,2113
"GOVT. VHSS, KADAKKAL, KOLLAM",G,2,2114
"VAKKANAD GOVT. HSS, KOTTARAKKARA, KOLLAM",G,2,2115
"GOVT. HSS, PERINAD, KOLLAM",G,2,2116
"ANCHAL EAST GOVT. HSS, ANCHAL, KOLLAM",G,2,2118
"SADANANDAPURAM GOVT. HSS, KOLLAM",G,2,2119
"GOVT. HSS, QUILON WEST, KOLLAM",G,2,2120
"SN TRUST HSS, CHATHANNOOR, KOLLAM",A,2,2121
"SN TRUST HSS, PUNALUR, KOLLAM",A,2,2122
"TECHNICAL HSS, CHADAYAMANGALAM,KOLLAM.",T,2,2123
"D.V.V. HSS THALAVOOR, PATHANAPURAM, KOLLAM",U,2,2124
"ST. THOMAS HSS, PUNALUR, KOLLAM",U,2,2125
"MES ENGLISH MEDIUM HSS, PANMANAM, KOLLAM",U,2,2126
"SREENIKETAN HSS, CHATHANNOOR, KOLLAM",U,2,2127
"SREE NARAYANA EMHSS, KOLLAM",U,2,2128
"VIVEKANANDA HSS, CHANGANKULANGARA, KOLLAM",U,2,2129
"GOVT. BHSS, ADOOR, PATHANAMTHITTA",G,3,3001
"GOVT. HSS, CHITTAR, VADASSERIKARA,",G,3,3002
"GOVT. HSS, EZHUMATTOOR, PATHANAMTHITTA",G,3,3003
"GOVT.HSS, KADAMMANITTA, PATHANAMTHITTA",G,3,3004
"K S GOVT HSS, KADAPRA, PATHANAMTHITTA",G,3,3005
"GOVT HSS, KALANJOOR, PATHANAMTHITTA",G,3,3006
"GOVT HSS, VECHOOCHIRA COLONY, PATHANAMTHITTA",G,3,3007
"GOVT HSS, THOTTAKONAM, PATHANAMTHITTA",G,3,3008
"GOVT HSS KONNI, PATHANAMTHITTA",G,3,3009
"GOVT BOYS HSS,PATHANAMTHITTA,PATHANAMTHITTA",G,3,3010
"GOVT HSS,KOIPPURAM,PATHANAMTHITTA",G,3,3011
"EDAMURI GOVT HSS, RANNI, PATHANAMTHITTA",G,3,3012
"GOVT HSS,OMALLOOR,PATHANAMTHITTA",G,3,3013
"GOVT HSS,KADUMEENCHIRA,PATHANAMTHITTA",G,3,3014
"S C S HSS, THIRUVALLA, PATHANAMTHITTA",A,3,3015
"M G M HSS, THIRUVALLA, PATHANAMTHITTA",A,3,3016
"BALIKAMATOM GHSS, THIRUVALLA, PATHANAMTHITTA",A,3,3017
"C M S HSS, MALLAPPALLY, PATHANAMTHITTA",A,3,3018
"N S S HSS, KUNNANTHANAM, PATHANAMTHITTA",A,3,3019
"S T B C  HSS, CHENGAROOR P O, MALLAPALLY,",A,3,3020
"N S S HSS, THATTAYIL, PATHANAMTHITTA",A,3,3021
"ST. THOMAS, HSS, KOZHANCHERY, PATHANAMTHITTA",A,3,3022
"CATHOLICATE HSS, PATHANAMTHITTA",A,3,3023
"M S HSS, RANNI, PATHANAMTHITTA",A,3,3024
"S C HSS, CHELLAKADU, PATHANMTHITTA",A,3,3025
"S N D P HSS, VENKURINJI, PATHANAMTHITTA",A,3,3026
"N S S HSS, THADIYOOR, PATHANAMTHITTA",A,3,3027
"PADMANABHODAYAM HSS, MEZHUVELI,",A,3,3028
"D B HSS, THIRUVALLA, PATHANAMTHITTA",A,3,3029
"N S S HSS, ADOOR, PATHANAMTHITTA",A,3,3030
"S N V HSS, ANGADICAL SOUTH, PATHANAMTHITTA",A,3,3031
"S N D P HSS, CHENNEERKKARA, PATHANAMTHITTA",A,3,3032
"ABRAHAM M M HSS, EDAYARANMULA,",A,3,3033
"NSS HSS,KAVIYOOR,PATHANAMTHITTA",A,3,3034
"DBHSS,PARUMALA,KADAPRA,PATHANAMTHITTA",A,3,3035
"ST JOHNS HSS, ERAVIPEROOR, PATHANAMTHITTA",A,3,3036
"SNDP HSS,MUTTATHUKONAM,PATHANAMTHITTA",A,3,3037
"ST BEHANAN'S HSS, VENNIKKULAM, TIRUVALA, PATHANAMTHITTA",A,3,3038
"NSS BOYS HSS,PANDALAM,PATHANAMTHITTA",A,3,3039
"MG HSS,THUMPAMON,PATHANAMTHITTA",A,3,3040
"K.R.P.M. HSS, SEETHATHODE, PATHANAMTHITTA",A,3,3041
"PSVPM HSS,AYRAVON,KONNI,PATHANAMTHITTA",A,3,3042
"SNDP HSS, KARAMVELI, ELANTHOOR, PATHANAMTHITTA",A,3,3043
"ST THOMAS HSS,ERUVALLIPRA,PATHANAMTHITTA",A,3,3044
"MT HSS,PATHANAMTHITTA",A,3,3045
"CMS HSS,KUZHIKKALA,PATHANAMTHITTA",A,3,3046
"NSS HSS,CHOORAKODE,PATHANAMTHITTA",A,3,3047
"MANAKKALA CSI HSS(DEAF&DUMB), PATHANAMTHITTA",A,3,3048
"S V G V HSS, KIDANGANNOOR, PATHANAMTHITTA",A,3,3049
"TECHNICAL HSS, KALLOOPPARA, PATHANAMTHITTA",T,3,3050
"HOLY ANGELS EM HSS, ADOOR",U,3,3051
"GOOD SHEPHERD EM HSS, PERUMALA",U,3,3052
"NICHOLSON SYRIAN GHSS, MENJADI",U,3,3053
"ST. MARY'S R.E.M. HSS, MULLASSERY, NEC CLUBBED TO 03009",U,3,3054
"BETHANY ST. MARY'S GHSS, PERINAD, RANNI",U,3,3055
"SH HSS, MYLAPRA",U,3,3056
"KADAMPANADU HSS, KADAMPANADU",U,3,3057
"MK GAM HSS, MANNADY",U,3,3058
"SCHOOL FOR THE DEAF, ENATHU",U,3,3059
"MOUNT BETHANY EM HSS, MYLAPRA",U,3,3060
"ST. THOMAS HSS, RANNI",U,3,3061
"MPV HSS, KUMBHAZHA, PATHANAMTHITTA",U,3,3062
"ST. PAUL'S HSS, NARIYAPURAM, MAMPILALI",U,3,3063
"NETAJI HSS, PRAMADOM, MALLASSERY",U,3,3064
"SCV HSS, KOOTTANADU",U,3,3065
"PMV HSS, PERINGARA, THIRUVALLA",U,3,3066
"NMHSS, KARIMPLAVU",U,3,3067
"CMS HSS, KUMBALAMPOIKA, PATHANAMTHITTA",U,3,3068
"NMHSS, KUMBANADU",U,3,3069
"TECHNICAL HSS, ADOOR",T,3,3070
"TECHNICAL HSS, ARANMULA, KOZHENCHERY",T,3,3071
"GOVT. HSS, KISIMUM, THULAPALLY, PATHANAMTHITTA",G,3,3072
"GOVT. GIRLS HSS, ADOOR, PATHANAMTHITTA",G,3,3073
"GOVT. HSS, TRICHENNAMANGALAM, PERINGANAD, PATHANAM",G,3,3074
"GHSS, ELIMULLUMPLACKAL, PATHANAMTHITTA",G,3,3075
"MRSLB VGHSS, VAIPUR, MALLAPPALLY, PATHANAMTHITTA",G,3,3076
"GHSS, THUMPAMON NORTH, PATHANAMTHITTA",G,3,3077
"GHSS, THEKKUTHODE, PATHANAMTHITTA",G,3,3078
"GHSS, AYIROOR, PATHANAMTHITTA",G,3,3079
"KULANADA PANCHAYAT HSS, KULANADA, PATHANAMTHITTA",G,3,3080
"GHSS THENGAMAM, PATHANAMTHITTA",G,3,3081
"GHSS MANCODE, PATHANAMTHITTA",G,3,3082
"ST.MARY'S MAHILA MANDIRAM, GIRLS HSS, ADOOR",A,3,3083
"TECHNICAL HSS, KALANJOOR, PATHANAMTHITTA",T,3,3084
"BRETHREN HSS, KUMBANAD, PTA",U,3,3085
"MGD HSS, PUDUSSERI, PATHANAMTHITTA",U,3,3086
"REPUBLICAN VOCATIONAL HSS, KONNI, PATHANAMTHITTA",U,3,3087
"ST. GEORGE'S MOUNT HSS, KAIPATTOOR, PATHANAMTHITTA",U,3,3088
"MODEL RESIDENTIAL SCHOOL, VADASSERIKKARA, PATHANAMTHITTA",G,3,3089
"GOVT HSS, ALA, ALAPPUZHA",G,4,4001
"GOVT MHSS, AMBALAPPUZHA, ALAPPUZHA",G,4,4002
"S N M GOVT BHSS, CHERTHALA, ALAPPUZHA",G,4,4003
"GOVT MBHSS, HARIPPAD, ALAPPUZHA",G,4,4004
"GOVT HSS, KALAVOOR, ALAPPUZHA",G,4,4005
"GOVT BOYS HSS, KAYAMKULAM, ALAPPUZHA",G,4,4006
"GOVT HSS, KIDANGARA, ALAPPUZHA",G,4,4007
"GOVT HSS, KUNNAM, ALAPPUZHA",G,4,4008
"GOVT HSS, PERUMPALAM, ALAPPUZHA",G,4,4009
"GOVT HSS, CHANDIROOR, ALAPPUZHA",G,4,4010
"GOVT DVHSS, CHARAMANGALAM, ALAPPUZHA",G,4,4011
"GOVT MUHAMADEN'S BOYS HSS, ALAPPUZHA",G,4,4012
"GOVT GHSS, MAVELIKKARA, ALAPPUZHA",G,4,4013
"GOVT HSS, THIRUVANVANDOOR, ALAPPUZHA",G,4,4014
"GOVT HSS, BUDHANOOR, ALAPPUZHA",G,4,4015
"KKM GOVT HSS, ELIPPAKKULAM, ALAPPUZHA",G,4,4016
"GOVT HSS, ANGADIKKAL SOUTH, ALAPPUZHA",G,4,4017
"GOVT VHSS,CHUNAKKARA,ALAPPUZHA",G,4,4018
"GOVT HSS,MANGALAM,ALAPPUZHA",G,4,4019
"GOVT HSS,AYAPARAMBU,ALAPPUZHA",G,4,4020
"GOVT HSS,SL PURAM,KANJIKKUZHI,ALAPPUZHA",G,4,4021
"GOVT GIRLS HSS, CHERTHALA, ALAPPUZHA",G,4,4022
"GOVT GIRLS HSS,HARIPPAD,ALAPPUZHA",G,4,4023
"GOVT GIRLS HSS,KAYAMKULAM,ALAPPUZHA",G,4,4024
"GOVT SCU VHSS,PATTANAKKAD,ALAPPUZHA",G,4,4025
"GOVT VHSS,MULAKKUZHA,ALAPPUZHA",G,4,4026
"TD HSS, THURAVOOR, ALAPPUZHA",A,4,4027
"VADUTHALA JUMA HATH HSS, NAVADUVATHU NAGAR,",A,4,4028
"LAJANATHUL MUHAMMADI HSS, ALLAPPUZHA",A,4,4029
"ST. JOSEPH'S GHSS, ALLAPPUZHA",A,4,4030
"AGRM HSS, VALLIKKUNNAM, ALLAPPUZHA",A,4,4031
"N S HSS, NEDUMUDI, ALAPPUZHA",A,4,4032
"ST. MARY'S HSS, CHAMPAKKULAM, ALAPPUZHA",A,4,4033
"ARAVUKAD HSS, PUNNAPPRA, ALAPPUZHA",A,4,4034
"S N D P HSS , KUTTAMANGALAM, ALAPPUZHA",A,4,4035
"ST. ALOSIOUS HSS, EDATHUA, ALLAPPUZHA",A,4,4036
"N S S HSS, RAMANKARI, ALAPPUZHA",A,4,4037
"N S S HSS, KARUVATTA, ALAPPUZHA",A,4,4038
"M S M HSS, KAYAMKULAM, ALLAPPUZHA",A,4,4039
"BISHOP HODGES HSS, MAVELIKKARA, ALLAPPUZHA",A,4,4040
"POPE PIOUS XI HSS, BHARANIKKAVU, ALLAPPUZHA",A,4,4041
"V V HSS, THAMARAKKULAM , ALLAPPUZHA",A,4,4042
"NS BHSS, MANNAR, ALAPPUZHA",A,4,4043
"LEO XIII HSS, ALAPPUZHA",A,4,4044
"S N M HSS, PURAKKAD, ALAPPUZHA",A,4,4045
"S N HSS, POOCHACKAL, ALAPPUZHA",A,4,4046
"ST. FRANCIS ASSISSI HSS, ARTHINKAL, ALAPPUZHA",A,4,4047
"ST. JOSEPH'S HSS, PULINKUNNU, ALAPPUZHA",A,4,4048
"LM HSS,PACHA,ALAPPUZHA",A,4,4049
"ST JOHNS HSS,MATTOM,ALAPPUZHA",A,4,4050
"TD HSS,ALAPPUZHA",A,4,4051
"SD VB HSS,ALAPPUZHA",A,4,4052
"PADANILAM HSS,NOORANAD,ALAPPUZHA",A,4,4053
"DBHSS,THAKAZHI,ALAPPUZHA",A,4,4054
"RVSM HSS,PRAYAR,OCHIRA,ALAPPUZHA",A,4,4055
"NRPM HSS,KAYAMKULAM,ALAPPUZHA",A,4,4056
"MTM HSS,VENMANI,ALAPPUZHA",A,4,4057
"METROPOLITAN HSS,PUTHENKAVU,ALAPPUZHA",A,4,4058
"DBHSS,CHERIYANADU,ALAPPUZHA",A,4,4059
"BOYS VHSS,KANICHUKULANGARA,ALAPPUZHA",A,4,4060
"HOLI FAMILY BHSS MUTTAM,CHERTHALA,ALAPPUZHA",A,4,4061
"NSS HSS,PANAVALLI,ALAPPUZHA",A,4,4062
"HSS,KANDAMANGALAM,AROOR,ALAPPUZHA",A,4,4063
"ST AUGESTINE'S HSS,AROOR,ALAPPUZHA",A,4,4064
"AB VILASOM HSS,MUHAMMA,ALAPPUZHA",A,4,4065
"NSS HSS,KAVALAM,ALAPPUZHA",A,4,4066
"ST GEORGE HSS, MUTTAR, ALAPPUZHA",A,4,4067
"HSS,THIRUVAMBADI,ALAPPUZHA",A,4,4068
"HOLY FAMILY HSS,KATTOOR,ALAPPUZHA",A,4,4069
"KV SANSKRIT HSS,MUTHUKULAM,ALAPPUZHA",A,4,4070
"PKKSM HSS,KAYAMKULAM,ALAPPUZHA",A,4,4071
"SN TRUST HSS,MARARIKULAM NORTH,ALAPPUZHA",A,4,4072
"SAMAJAM HSS,MUTHUKULAM,ALAPPUZHA",A,4,4073
"SREE BHUVANESWARI  HSS, MANNAR",U,4,4074
"OUR LADY OF MERCY EM HSS, AROOR",U,4,4075
"ST. THOMAS HSS, NEERETTUPURAM",U,4,4076
"BISHOP MOORE HSS, AKANATTUKARA, MAVELIKARA",U,4,4077
"CARMEL ACADEMY EM HSS, PAZHAVANGADY, ALAPPUZHA",U,4,4078
"BETHANY BALIKAMATOM HSS, NANGIARKULANGARA",U,4,4079
"ST. MARY'S GHSS, KAYAMKULAM",U,4,4080
"SREE VITOBHA HSS, KAYAMKULAM",U,4,4081
"VHSS, CHATHIYARA, THAMARAKULAM",U,4,4082
"KKKVM HSS, POOTHAPPALLY SOUTH, HARIPPAD",U,4,4083
"ST. ANNE'S GHSS, ANGADIKKAL, CHENGANNUR",U,4,4084
"NADUVATTOM HSS, PALLIPADU",U,4,4085
"SDA HSS, MAVELIKKARA, NON EXAM CENTRE CLUBBED TO 04013",U,4,4086
"TECHNICAL HSS, PERISSERY, CHENGANNUR",T,4,4087
"GOVT. HSS, THIRUNELOOR, CHERTHALA, ALAPPUZHA",G,4,4088
"GOVT. HSS, CHERTHALA SOUTH, ALAPPUZHA",G,4,4089
"VAYALAR RAMA VARMA GOVT. HSS, VAYALAR, ALAPPUZHA",G,4,4090
"GOVT. VVHSS, KODENTHURUTHU, ALAPPUZHA",G,4,4091
"GOVT. HSS, RAMAPURAM, KEERIKKAD, ALAPPUZHA",G,4,4092
"GOVT. BHSS, MAVELIKKARA, ALAPPUZHA",G,4,4093
"K.K.KUNCHY PILLAI MEMORIAL HSS, AMBALAPPUZHA, ALAP",G,4,4094
"GOVT. GIRLS HSS, ALAPPUZHA",G,4,4095
"GOVT. VHSS, ARYAD, ALAPPUZHA",G,4,4096
"GOVT. HSS, THALAVADY, KUTTANAD, ALAPPUZHA",G,4,4097
"GOVT. MOHAMMADENS GIRLS HSS, ALAPPUZHA",G,4,4098
"GOVT. HSS, THANNEERMUKKAM, ALAPPUZHA",G,4,4099
"KUDASSANAD THANDANAVILA GS VHSS, ALAPPUZHA",G,4,4100
"VALIYAZHEEKKAL GOVT. HSS, ALAPPUZHA",G,4,4101
"SN TRUST HSS, CHERIYANAD, ALAPPUZHA",A,4,4102
"SN TRUST HSS, PALLIPPAD, ALAPPUZHA",A,4,4103
"TECHNICAL HSS, IHRD,PALLIPURAM P.O,CHERTHALA,ALAPP",T,4,4104
"CBM HSS, NOORANAD, ALAPPUZHA",U,4,4105
"NSS HIGH SCHOOL, KARUVATTA, ALAPPUZHA, (SUB CENTRE OF 04038)",U,4,4106
"MODEL RESIDENTIAL SCHOOL  PUNNAPRA, ALAPUZHA",G,4,4107
"GOVT. HSS, ERATTUPETTAH, ARUVITHURA P.O., KOTTAYAM",G,5,5001
"GOVT. HSS, KADAPPOOR , KOTTAYAM",G,5,5002
"GOVT. HSS KARAPPUZHA, KARAPPUZHA P.O., KOTTAYAM",G,5,5003
"GOVT. MHSS,  KOTTAYAM",G,5,5004
"GOVT. HSS, KUMARAKAM , KOTTAYAM",G,5,5005
"GOVT. HSS, PALA, KOTTAYAM",G,5,5006
"GOVT. HSS, PANAMATTOM, KOTTAYAM",G,5,5007
"GOVT. HSS, THAZHATHUVADAKARA P.O., KOTTAYAM",G,5,5008
"GOVT. HSS, THRIKKODITHANAM, KOTTAYAM",G,5,5009
"GOVT. GIRLS HSS, VAIKOM, KOTTAYAM",G,5,5010
"GOVT. HSS, VADAKKEKKARA, KOTTAYAM",G,5,5011
"GOVT. HSS, VAIKOM, THEKKENADA P.O., KOTTAYAM",G,5,5013
"GOVT. HSS PERUVA , PERUVA P.O., KOTTAYAM",G,5,5014
"GOVT. BOYS HSS, PUTHUPALLY, KOTTAYAM",G,5,5015
"MCG HSS, ARPOOKARA, GANDHINAGAR P.O., KOTTAYAM",G,5,5016
"GOVT HSS, AREEPARAMBU, VIJAYAPURAM, KOTTAYAM",G,5,5017
"GOVT HSS KUDAMALOOR, KUDAMALOOR P.O., KOTTAYAM",G,5,5018
"GOVT HSS, KURICHY, NEELAMPEROOR P.O., KOTTAYAM",G,5,5019
"GOVT HSS, EDAKKOLI, CHAKKAMPUZHA P.O., KOTTAYAM",G,5,5020
"SKV GOVT HSS, NEENDOOR, KOTTAYAM",G,5,5021
"GOVT HSS, TV PURAM, VAIKOM, KOTTAYAM",G,5,5022
"GOVT HSS KANAKARY, KANAKARY P.O., KOTTAYAM",G,5,5023
"GOVT HSS,KULASEKHARAMANGALAM,KOTTAYAM",G,5,5024
"AJJM GHSS, THALAYOLAPARAMBU, KOTTAYAM",G,5,5025
"GOVT. VHSS PONKUNNAM, PONKUNNAM P.O., VAZHOOR, KOTTAYAM",G,5,5026
"GOVT. HSS, NEDUMKUNNAM, KOTTAYAM",G,5,5027
"GOVT. HSS,EDAKUNNAM,KOTTAYAM",G,5,5028
"GOVT. VHSS, MURIKKUMVAYAL, KURIVILAM P.O., KOTTAYAM",G,5,5029
"M G M NSS HSS LAKKATTOOR, LAKKATTOOR P.O., KOTTAYAM",A,5,5030
"M G HSS, ERATTUPETTA, NADACKAL P.O., KOTTAYAM",A,5,5031
"M T S HSS, KOTTAYAM",A,5,5032
"M D S HSS, KOTTAYAM",A,5,5033
"BAKER MEMORIAL GHSS, KOTTAYAM",A,5,5034
"ST MARY'S HSS, MANARCAD, KOTTAYAM",A,5,5035
"NSS HSS KARUKACHAL, KARUKACHAL P.O., KOTTAYAM",A,5,5036
"ST. JOHN'S BAPTISTS HSS, NEDUMKUNNAM, KOTTAYAM",A,5,5037
"JM HSS, VAKATHANAM, PUTHENCHANTHA P.O., KOTTAYAM",A,5,5038
"ST. EMPHREMS HSS MANNANAM, MANNANAM P.O., KOTTAYAM",A,5,5039
"SMV HSS POONJAR, POONJAR P.O., KOTTAYAM",A,5,5040
"ST. ANTONY'S HSS PLASSANAL, PLASSANAL P.O., KOTTAYAM",A,5,5041
"ST.SEBASTIAN'S HSS, KADANAD, KOTTAYAM",A,5,5042
"ST. MARY'S HSS, BHARANANGANAM, KOTTAYAM",A,5,5043
"ST. MARY'S HSS TEEKOY, TEEKOY P.O., KOTTAYAM",A,5,5044
"CMS HSS MELUKAVU, MELUKAVU P.O., KOTTAYAM",A,5,5045
"JJMM HSS YENDAYAR, YENDAYAR P.O., KOTTAYAM",A,5,5046
"C.KESAVAN MHSS, KORUTHODE, KOTTAYAM",A,5,5047
"VISWABHARATHI SN HSS NEEZHOOR, NEEZHOOR P.O., KOTTAYAM",A,5,5048
"ST. LITTLE THERESAS GHSS, VAIKOM, THEKKENADA P.O., KOTTAYAM",A,5,5049
"HOLY CROSS HSS CHERPUNKAL, CHERPUNKAL P.O., KOTTAYAM",A,5,5050
"SMV NSS HSS KALLARA, KALLARA P.O., KOTTAYAM",A,5,5051
"ST.MICHAELS HSS, KADATHURUTHY, KOTTAYAM",A,5,5052
"ST. MARY'S  HSS KURAVILANGAD, KURAVILANGAD P.O., KOTTAYAM",A,5,5053
"ST. THOMAS HSS, PALA, KOTTAYAM",A,5,5054
"ST. PETER'S  HSS, KURUMBANADOM, PERUMPANACHY P.O., KOTTAYAM",A,5,5055
"SB HSS CHANGANACHERRY, CHANGANACHERRY P.O., KOTTAYAM",A,5,5056
